subj,run,item,list,category,sentence,joke ending,nonjoke ending,displayed,response,RT,question onset,para conditionsKAN_RHnonlit_09,1,97,2,nonjoke,"When I found out how much my wife spent on dresses last year, I dumped her and proposed to the",dressmaker,mistress,"When I found out how much my wife spent on dresses last year, I dumped her and proposed to the mistress.",1,0.435259819,6.001285076,2KAN_RHnonlit_09,1,147,2,nonjoke,"When we got divorced, my wife and I split the house; she got the",inside,kitchen,"When we got divorced, my wife and I split the house; she got the kitchen.",2,1.222098112,16.01206493,3KAN_RHnonlit_09,1,90,2,joke,A vacation is the shortest distance between two,paychecks,locations,A vacation is the shortest distance between two paychecks.,1,1.439716101,24.01399493,2KAN_RHnonlit_09,1,103,2,nonjoke,"I still miss my ex-wife, but I am improving my",aim,ego,"I still miss my ex-wife, but I am improving my ego.",1,0.903961897,34.00808406,2KAN_RHnonlit_09,1,120,2,joke,Two things are essential for success: wealth and,money,fame,Two things are essential for success: wealth and money.,1,1.473052979,44.00218487,2KAN_RHnonlit_09,1,101,2,nonjoke,"I got a car for my wife, and I thought it was a good",trade,choice,"I got a car for my wife, and I thought it was a good choice.",1,1.925170898,54.01286197,2KAN_RHnonlit_09,1,29,2,nonjoke,My doctor has never violated his oath: the oath he took years ago to become a,millionaire,practitioner,My doctor has never violated his oath: the oath he took years ago to become a practitioner.,1,1.473133802,64.00696206,2KAN_RHnonlit_09,1,68,2,joke,She always told girls not to look for a husband but just to date,bachelors,someone,She always told girls not to look for a husband but just to date bachelors.,3,1.355984926,72.00890207,4KAN_RHnonlit_09,1,100,2,joke,"I hope this train stops at Grand Central because if it doesn't, there will be a ",crash,delay,"I hope this train stops at Grand Central because if it doesn't, there will be a crash.",1,0.552780867,94.00577307,2KAN_RHnonlit_09,1,43,2,nonjoke,"I asked him if he started out as an editor, and he said that years ago he used to be a ",boy,journalist,"I asked him if he started out as an editor, and he said that years ago he used to be a journalist.",1,1.088248014,104.0165629,2KAN_RHnonlit_09,1,149,2,nonjoke,"She asked what state he was born in, and he said in the ",nude,East,"She asked what state he was born in, and he said in the East.",3,1.808053017,114.010623,4KAN_RHnonlit_09,1,51,2,nonjoke,I went to a place that serves breakfast any time and ordered French toast in the,Renaissance,nighttime,I went to a place that serves breakfast any time and ordered French toast in the nighttime.,2,1.992105961,122.012547,3KAN_RHnonlit_09,1,116,2,joke,Autobiography is an unrivaled vehicle for telling the truth about,others,somebody,Autobiography is an unrivaled vehicle for telling the truth about others.,1,1.121687174,142.0006199,2KAN_RHnonlit_09,1,126,2,joke,My husband took the money we were saving to buy a new car and blew it all at the,laundry,tables,My husband took the money we were saving to buy a new car and blew it all at the laundry.,4,0.703166962,156.012393,4KAN_RHnonlit_09,1,148,2,joke,The best bargain I ever got was when I went to a family garage sale and bought a ,grandma,toaster,The best bargain I ever got was when I went to a family garage sale and bought a grandma.,4,1.021137953,168.015383,4KAN_RHnonlit_09,1,8,2,joke,Last Thanksgiving my wife spent all morning in the kitchen stuffing the,kids,bird,Last Thanksgiving my wife spent all morning in the kitchen stuffing the kids.,4,0.736549854,180.001497,4KAN_RHnonlit_09,1,18,2,joke,"When we watch a sexy movie, my wife leans over and breathes on my",glasses,collar,"When we watch a sexy movie, my wife leans over and breathes on my glasses.",3,0.770218134,190.0122609,4KAN_RHnonlit_09,1,131,2,nonjoke,"Statistics indicate that Americans spend eighty million a year on games of chance, mostly",weddings, blackjack,"Statistics indicate that Americans spend eighty million a year on games of chance, mostly blackjack.",2,1.406208038,198.014159,3KAN_RHnonlit_09,1,146,2,joke,"Love has its benefits, and they are usually called",alimony,memories,"Love has its benefits, and they are usually called alimony.",4,0.836916924,206.016207,4KAN_RHnonlit_09,1,15,2,nonjoke,"When John bought a bulldog, it was no time at all before he had that dog eating out of his",leg,fingers,"When John bought a bulldog, it was no time at all before he had that dog eating out of his fingers.",1,1.10486412,218.002358,2KAN_RHnonlit_09,1,23,2,nonjoke,The curse of heavy drinking is that afterwards you get a huge,bar tab,headache,The curse of heavy drinking is that afterwards you get a huge headache.,1,0.468686819,232.0140591,2KAN_RHnonlit_09,1,11,2,nonjoke,"He owns stock in a company that pays quarterly dividends, so every three months they send him a",quarter,statement,"He owns stock in a company that pays quarterly dividends, so every three months they send him a statement.",1,1.607038975,240.016042,2KAN_RHnonlit_09,1,44,2,joke,The only place where you can find people who spend all their time minding their own business is the ,cemetery,bank,The only place where you can find people who spend all their time minding their own business is the cemetery.,4,1.389498949,248.0011311,4KAN_RHnonlit_09,1,84,2,joke,"The convict told his cellmate how he'd blown all the money he stole on wine, women, and ",lawyers,crack,"The convict told his cellmate how he'd blown all the money he stole on wine, women, and lawyers.",2,1.372869015,256.0031099,3KAN_RHnonlit_09,1,93,2,nonjoke,"He is probably the best boxer in the country, but he always loses in the ",city,competition,"He is probably the best boxer in the country, but he always loses in the competition.",2,0.970962048,276.0079,3KAN_RHnonlit_09,1,52,2,joke,My wife did natural childbirth: no,makeup,anesthetic,My wife did natural childbirth: no makeup.,4,0.38498807,284.0098579,4KAN_RHnonlit_09,1,74,2,joke,He's planning an extended vacation; he hopes to spend three weeks on his,couch,sailboat,He's planning an extended vacation; he hopes to spend three weeks on his couch.,3,1.35601902,294.0038989,4KAN_RHnonlit_09,1,111,2,nonjoke,"Some husbands are good providers, but only if you count",children,salary,"Some husbands are good providers, but only if you count salary.",4,0.452654839,316.000874,4KAN_RHnonlit_09,1,72,2,joke,The first two hundred story building opened in Chicago; it was a ,library,hotel,The first two hundred story building opened in Chicago; it was a library.,4,0.78678894,328.003787,4KAN_RHnonlit_09,1,71,2,nonjoke,Save the whales; start a,collection,coalition,Save the whales; start a coalition.,2,1.288999081,338.014596,3KAN_RHnonlit_09,1,20,2,joke,"He told me he just bought a set of balloon tires, and I told him I didn't even know he owned a",balloon,truck,"He told me he just bought a set of balloon tires, and I told him I didn't even know he owned a balloon.",,,348.00859,1KAN_RHnonlit_09,1,129,2,nonjoke,The perfect companion to a vegetarian dinner is a ,steak,salad,The perfect companion to a vegetarian dinner is a salad.,2,0.970958948,360.011538,3KAN_RHnonlit_09,1,12,2,joke,In some marriages the bride is given away by the ,press,family ,In some marriages the bride is given away by the press.,1,0.736468792,370.0056031,2KAN_RHnonlit_09,1,24,2,joke,"Where I'm from, the two most common elements are hydrogen and ",stupidity,nitrogen,"Where I'm from, the two most common elements are hydrogen and stupidity.",3,1.389394999,380.016346,4KAN_RHnonlit_09,1,26,2,joke,"To clothe one soldier, it takes the wool from two sheep and the hides from three",taxpayers,animals,"To clothe one soldier, it takes the wool from two sheep and the hides from three taxpayers.",3,1.757659197,392.0025449,4KAN_RHnonlit_09,1,10,2,joke,Nothing in the known universe travels faster than,gossip,radiation,Nothing in the known universe travels faster than gossip.,4,0.334789038,400.0043979,4KAN_RHnonlit_09,1,151,2,nonjoke,One good turn gets most of the,blanket,profit,One good turn gets most of the profit.,1,0.351504087,408.0064139,2KAN_RHnonlit_09,1,45,2,nonjoke,"She is so modest, she pulls down the shade to change her", mind,jacket,"She is so modest, she pulls down the shade to change her jacket.",3,1.506585121,424.0102489,4KAN_RHnonlit_09,1,95,2,nonjoke,He was teaching his girlfriend how to swim when the lifeguard made them move to the ,lake,shallows,He was teaching his girlfriend how to swim when the lifeguard made them move to the shallows.,1,1.339206934,438.0052531,2KAN_RHnonlit_09,1,36,2,joke,A problem drinker is one who never,buys,quits,A problem drinker is one who never buys.,4,0.836992979,450.008146,4KAN_RHnonlit_09,1,63,2,nonjoke,"It's hard to raise a family nowadays, especially in the ",morning,country,"It's hard to raise a family nowadays, especially in the country.",1,0.853818178,458.0100389,2KAN_RHnonlit_09,1,46,2,joke,Arguments between couples are healthy; sometimes they even prevent,marriage,breakups,Arguments between couples are healthy; sometimes they even prevent marriage.,4,0.569214106,466.0119529,4KAN_RHnonlit_09,1,135,2,nonjoke,"My mechanic couldn't fix my brakes, so he fixed my",horn,clutch,"My mechanic couldn't fix my brakes, so he fixed my clutch.",1,0.669639111,474.013917,2KAN_RHnonlit_09,1,1,2,nonjoke,"When I asked how long he should cook the noodles, I said at least ten",inches,seconds,"When I asked how long he should cook the noodles, I said at least ten seconds.",1,1.322530031,484.0079169,2KAN_RHnonlit_09,1,112,2,joke,The art museum just acquired an early Rembrandt; it's done in ,Crayola,charcoal,The art museum just acquired an early Rembrandt; it's done in Crayola.,2,1.07140398,492.0098491,3KAN_RHnonlit_09,1,2,2,joke,"She went on a fourteen day diet, but she only lost two",weeks,ounces,"She went on a fourteen day diet, but she only lost two weeks.",4,0.686373949,504.012805,4KAN_RHnonlit_09,1,137,2,nonjoke,A man who has lost ninety percent of his brain is called a,widower,zombie,A man who has lost ninety percent of his brain is called a zombie.,4,0.703161955,512.014698,4KAN_RHnonlit_09,1,133,2,nonjoke,He likes to make things around the house; this week it's the,maid,shelves,He likes to make things around the house; this week it's the shelves.,1,1.138324976,522.008827,2KAN_RHnonlit_09,1,109,2,nonjoke,Many a freshman helps the college of his choice by becoming a ,dropout,member,Many a freshman helps the college of his choice by becoming a member.,2,1.138267994,532.0028949,3KAN_RHnonlit_09,1,31,2,nonjoke,"He told her he wasn't himself, and she said she'd noticed the",improvement,problem,"He told her he wasn't himself, and she said she'd noticed the problem.",1,1.355996132,540.0047259,2KAN_RHnonlit_09,1,50,2,joke,The only time my father ever raised a hand to his children was in ,self- defense,discipline,The only time my father ever raised a hand to his children was in self- defense.,2,1.489778996,550.01562,3KAN_RHnonlit_09,1,140,2,joke,You can keep your kids in hot water with ,dishes,rules,You can keep your kids in hot water with dishes.,1,1.272313118,560.0095849,2