subj,run,item,list,category,sentence,joke ending,nonjoke ending,displayed,response,RT,question onset,para conditionsKAN_RHnonlit_01,1,12,1,nonjoke,In some marriages the bride is given away by the ,press,family ,In some marriages the bride is given away by the family .,,,6.009151936,1KAN_RHnonlit_01,1,35,1,joke,"Now that the Hollywood couple has ironed out the divorce settlement, they can finally go ahead with their",nuptials,careers,"Now that the Hollywood couple has ironed out the divorce settlement, they can finally go ahead with their nuptials.",3,0.366620064,16.00815797,4KAN_RHnonlit_01,1,99,1,joke,"He's never given a girl a present, but he did give a few a pretty good",reputation,surprise,"He's never given a girl a present, but he did give a few a pretty good reputation.",4,0.799914122,24.00728893,4KAN_RHnonlit_01,1,145,1,joke,The only person who sticks closer to you in adversity than a friend is a,creditor,spouse,The only person who sticks closer to you in adversity than a friend is a creditor.,,,34.00627804,1KAN_RHnonlit_01,1,65,1,joke,A good way to blow your mind is to smoke ,gunpowder,heroin,A good way to blow your mind is to smoke gunpowder.,3,0.316503048,44.00539494,4KAN_RHnonlit_01,1,55,1,joke,His wife sued for divorce and asked for custody of the,cash,cat,His wife sued for divorce and asked for custody of the cash.,1,0.349948883,54.00439215,2KAN_RHnonlit_01,1,25,1,joke,The only thing money can't buy is,poverty,generosity,The only thing money can't buy is poverty.,,,64.00335312,1KAN_RHnonlit_01,1,47,1,joke,"Charged with statutory rape, he told the judge he didn't know she was a ",statue,teenager,"Charged with statutory rape, he told the judge he didn't know she was a statue.",3,0.88320303,72.00254512,4KAN_RHnonlit_01,1,17,1,joke,A committee keeps minutes and takes,hours,votes,A committee keeps minutes and takes hours.,2,0.383243084,94.00037098,3KAN_RHnonlit_01,1,112,1,nonjoke,The art museum just acquired an early Rembrandt; it's done in ,Crayola,charcoal,The art museum just acquired an early Rembrandt; it's done in charcoal.,1,0.666673183,104.016001,2KAN_RHnonlit_01,1,50,1,nonjoke,The only time my father ever raised a hand to his children was in ,self- defense,discipline,The only time my father ever raised a hand to his children was in discipline.,1,0.949872017,114.0150471,2KAN_RHnonlit_01,1,133,1,joke,He likes to make things around the house; this week it's the,maid,shelves,He likes to make things around the house; this week it's the maid.,2,0.833168983,122.0142632,3KAN_RHnonlit_01,1,60,1,nonjoke,Another thing a small boy is constantly outgrowing is his,allowance,underwear,Another thing a small boy is constantly outgrowing is his underwear.,2,1.866433859,142.0122821,3KAN_RHnonlit_01,1,14,1,nonjoke,He got a medal for bravery on the beach when he rescued a girl from a ,lifeguard,shipwreck,He got a medal for bravery on the beach when he rescued a girl from a shipwreck.,1,1.133255005,156.010838,2KAN_RHnonlit_01,1,2,1,nonjoke,"She went on a fourteen day diet, but she only lost two",weeks,ounces,"She went on a fourteen day diet, but she only lost two ounces.",1,1.633090019,168.009726,2KAN_RHnonlit_01,1,155,1,joke,The show had one act that was really offbeat: the,singer,clowns,The show had one act that was really offbeat: the singer.,2,1.549823999,180.0084481,3KAN_RHnonlit_01,1,136,1,nonjoke,The only fishing through the ice that some men ever do is for the ,olive,trout,The only fishing through the ice that some men ever do is for the trout.,1,1.066567898,190.0074971,2KAN_RHnonlit_01,1,67,1,joke,The most prevalent form of legalized gambling is,elections,betting,The most prevalent form of legalized gambling is elections.,3,0.999855042,198.006707,4KAN_RHnonlit_01,1,4,1,nonjoke,I knew a streetwalker who was so exclusive she had an unlisted telephone,booth,line,I knew a streetwalker who was so exclusive she had an unlisted telephone line.,4,1.483263969,206.005831,4KAN_RHnonlit_01,1,19,1,joke,"I decided to start saving for a rainy day, so I went to a savings and loan and deposited my",umbrella,pay,"I decided to start saving for a rainy day, so I went to a savings and loan and deposited my umbrella.",4,0.716542006,218.004714,4KAN_RHnonlit_01,1,23,1,joke,The curse of heavy drinking is that afterwards you get a huge,bar tab,headache,The curse of heavy drinking is that afterwards you get a huge bar tab.,1,1.283195972,232.0033071,2KAN_RHnonlit_01,1,45,1,joke,"She is so modest, she pulls down the shade to change her", mind,jacket,"She is so modest, she pulls down the shade to change her mind.",4,0.54980588,240.0025752,4KAN_RHnonlit_01,1,64,1,nonjoke,The best way to stop an elephant from charging is to cut off its,credit,toes,The best way to stop an elephant from charging is to cut off its toes.,2,0.383274078,248.001771,3KAN_RHnonlit_01,1,15,1,joke,"When John bought a bulldog, it was no time at all before he had that dog eating out of his",leg,fingers,"When John bought a bulldog, it was no time at all before he had that dog eating out of his leg.",,,256.0008891,1KAN_RHnonlit_01,1,63,1,joke,"It's hard to raise a family nowadays, especially in the ",morning,country,"It's hard to raise a family nowadays, especially in the morning.",3,0.349863052,276.01565,4KAN_RHnonlit_01,1,127,1,joke,The penalty for dishonesty is the disgrace of dying,rich,unloved,The penalty for dishonesty is the disgrace of dying rich.,1,1.499838114,284.014796,2KAN_RHnonlit_01,1,42,1,nonjoke,The best way to keep the milk from turning sour is to keep it in the,cow,cold,The best way to keep the milk from turning sour is to keep it in the cold.,1,0.366626978,294.0138581,2KAN_RHnonlit_01,1,90,1,nonjoke,A vacation is the shortest distance between two,paychecks,locations,A vacation is the shortest distance between two locations.,,,316.0116291,1KAN_RHnonlit_01,1,96,1,nonjoke,"When the kid came into the store and asked for empty boxes, the owner gave him the",register,crate,"When the kid came into the store and asked for empty boxes, the owner gave him the crate.",1,0.41653204,328.010474,2KAN_RHnonlit_01,1,156,1,nonjoke,The only ones who want me for my body are,mosquitos,losers,The only ones who want me for my body are losers.,1,1.249936819,338.0094261,2KAN_RHnonlit_01,1,34,1,nonjoke,"He asked if I'd join him in a bowl of soup, but I told him we didn't have enough",room,change,"He asked if I'd join him in a bowl of soup, but I told him we didn't have enough change.",,,348.0085011,1KAN_RHnonlit_01,1,1,1,joke,"When I asked how long he should cook the noodles, I said at least ten",inches,seconds,"When I asked how long he should cook the noodles, I said at least ten inches.",2,1.216528177,360.007252,3KAN_RHnonlit_01,1,114,1,nonjoke,It's extraordinary what fine poker hand you get when you're playing,bridge,stud,It's extraordinary what fine poker hand you get when you're playing stud.,2,0.933322906,370.006242,3KAN_RHnonlit_01,1,5,1,joke,She read so much about the bad effects of cigarettes she decided to give up the,reading,habit,She read so much about the bad effects of cigarettes she decided to give up the reading.,3,0.349903822,380.0052521,4KAN_RHnonlit_01,1,131,1,joke,"Statistics indicate that Americans spend eighty million a year on games of chance, mostly",weddings, blackjack,"Statistics indicate that Americans spend eighty million a year on games of chance, mostly weddings.",4,0.499987125,392.004045,4KAN_RHnonlit_01,1,113,1,joke,Some people's only culture is,bacteria,radio,Some people's only culture is bacteria.,3,0.299887896,400.0033531,4KAN_RHnonlit_01,1,120,1,nonjoke,Two things are essential for success: wealth and,money,fame,Two things are essential for success: wealth and fame.,2,0.933260918,408.0025091,3KAN_RHnonlit_01,1,105,1,joke,The book that tells you where you can go on vacation is called a,checkbook,guidebook,The book that tells you where you can go on vacation is called a checkbook.,3,0.583323956,424.0008531,4KAN_RHnonlit_01,1,26,1,nonjoke,"To clothe one soldier, it takes the wool from two sheep and the hides from three",taxpayers,animals,"To clothe one soldier, it takes the wool from two sheep and the hides from three animals.",1,0.733261108,438.01612,2KAN_RHnonlit_01,1,48,1,nonjoke,"The new tax forms are more realistic: where your wife signs, it says","""accomplice""","""partner""","The new tax forms are more realistic: where your wife signs, it says ""partner"".",2,1.283120155,450.01508,3KAN_RHnonlit_01,1,73,1,joke,One thing that makes the world go round is,detours,greed,One thing that makes the world go round is detours.,3,0.333286047,458.014189,4KAN_RHnonlit_01,1,150,1,nonjoke,One way to keep pornography away from teenagers is to put it in a,textbook,cabinet,One way to keep pornography away from teenagers is to put it in a cabinet.,2,0.466620922,466.0133572,3KAN_RHnonlit_01,1,93,1,joke,"He is probably the best boxer in the country, but he always loses in the ",city,competition,"He is probably the best boxer in the country, but he always loses in the city.",3,0.783261061,474.0125771,4KAN_RHnonlit_01,1,39,1,joke,The best way to remove coffee stains from a white blouse is with,scissors,detergent,The best way to remove coffee stains from a white blouse is with scissors.,3,0.866590023,484.011626,4KAN_RHnonlit_01,1,141,1,joke,The only crop that is grown in America and harvested abroad is the American,tourist,tobacco,The only crop that is grown in America and harvested abroad is the American tourist.,2,1.083124876,492.0108831,3KAN_RHnonlit_01,1,115,1,joke,"In the game of golf, nothing counts as much as your",opponent,drives,"In the game of golf, nothing counts as much as your opponent.",3,0.46665597,504.009593,4KAN_RHnonlit_01,1,78,1,nonjoke,My brother-in-law enjoys fixing things around the house so much he spent an hour last night just fixing our,drinks,stove,My brother-in-law enjoys fixing things around the house so much he spent an hour last night just fixing our stove.,1,1.199886084,512.008848,2KAN_RHnonlit_01,1,61,1,joke,"For great vacation, put the kids in the back seat, and take a ",cruise,freeway,"For great vacation, put the kids in the back seat, and take a cruise.",2,1.249890089,522.007802,3KAN_RHnonlit_01,1,83,1,joke,Nothing ages a woman faster than,identification,hardship,Nothing ages a woman faster than identification.,2,1.716413975,532.006892,3KAN_RHnonlit_01,1,82,1,nonjoke,"When it comes to keeping warm, nothing beats a thermal",brunette,parka,"When it comes to keeping warm, nothing beats a thermal parka.",1,0.383275986,540.006041,2KAN_RHnonlit_01,1,89,1,joke,"Some babies are born to rule, while others are",male,weak,"Some babies are born to rule, while others are male.",3,0.349972963,550.005106,4KAN_RHnonlit_01,1,123,1,joke,Too many girls believe that the chief foundation for true love is a large,stone,fortune,Too many girls believe that the chief foundation for true love is a large stone.,1,0.866518974,560.0041201,2