subj,run,item,list,category,sentence,joke ending,nonjoke ending,displayed,response,RT,question onset
ev,1,64,1,nonjoke,The best way to stop an elephant from charging is to cut off its,credit,toes,The best way to stop an elephant from charging is to cut off its toes.,,,5.014003038406372
ev,1,94,1,nonjoke,"To get something done, a committee should consist of no more than three people, two of whom are",dead,workers,"To get something done, a committee should consist of no more than three people, two of whom are workers.",,,13.015907049179077
ev,1,17,1,joke,A committee keeps minutes and takes,hours,votes,A committee keeps minutes and takes hours.,,,23.009741067886353
ev,1,59,1,joke,"Women don't dress to please men; if they did, they'd dress a lot",faster,scantier,"Women don't dress to please men; if they did, they'd dress a lot faster.",,,31.012306928634644
ev,1,100,1,nonjoke,"I hope this train stops at Grand Central because if it doesn't, there will be a ",crash,delay,"I hope this train stops at Grand Central because if it doesn't, there will be a delay.",,,39.0002338886261
