subj,run,item,list,category,sentence,joke ending,nonjoke ending,displayed,response,RT,question onset
0.0000,8.000,1,100,1,nonjoke,"I hope this train stops at Grand Central because if it doesn't, there will be a ",crash,delay,"I hope this train stops at Grand Central because if it doesn't, there will be a delay.",<VisionEgg.WrappedText.WrappedText object at 0x10b79aaf0>
8.0000,2.000,fix
10.0000,8.000,1,102,1,nonjoke,We live in a lovely suburb; it's just two miles beyond our,income,town,We live in a lovely suburb; it's just two miles beyond our town.,<VisionEgg.WrappedText.WrappedText object at 0x10b79ac30>
18.0000,8.000,1,153,1,joke,The husband who catches his wife in the act is probably on the,trapeze,snoop,The husband who catches his wife in the act is probably on the trapeze.,<VisionEgg.WrappedText.WrappedText object at 0x10b79aaa0>
26.0000,2.000,fix
28.0000,8.000,1,86,1,nonjoke,"I asked the florist what I should give to my girlfriend, and he suggested his",address,tulips,"I asked the florist what I should give to my girlfriend, and he suggested his tulips.",<VisionEgg.WrappedText.WrappedText object at 0x10b79ad70>
36.0000,2.000,fix
38.0000,8.000,1,39,1,joke,The best way to remove coffee stains from a white blouse is with,scissors,detergent,The best way to remove coffee stains from a white blouse is with scissors.,<VisionEgg.WrappedText.WrappedText object at 0x10b79a7d0>
46.0000,2.000,fix
48.0000,8.000,1,76,1,nonjoke,"Parents support clubs for teenagers, especially when they lack other forms of",punishment,diversion,"Parents support clubs for teenagers, especially when they lack other forms of diversion.",<VisionEgg.WrappedText.WrappedText object at 0x10b79a6e0>
56.0000,2.000,fix
58.0000,8.000,1,122,1,nonjoke,"If you're filthy rich, sending your kids to college is a wonderful", cleaner,luxury,"If you're filthy rich, sending your kids to college is a wonderful luxury.",<VisionEgg.WrappedText.WrappedText object at 0x10b79abe0>
66.0000,8.000,1,79,1,joke,She puts something behind her ears to attract men; lately she's been using her,ankles,vanilla,She puts something behind her ears to attract men; lately she's been using her ankles.,<VisionEgg.WrappedText.WrappedText object at 0x10b79a870>
74.0000,14.000,fix
88.0000,8.000,1,13,1,joke,A device for finding furniture in the dark is a ,shin,candle,A device for finding furniture in the dark is a shin.,<VisionEgg.WrappedText.WrappedText object at 0x10b79a780>
96.0000,2.000,fix
98.0000,8.000,1,54,1,nonjoke,The tourist bureau told the visitors there was plenty of hunting in this part of the country but very little,finding,sightseeing,The tourist bureau told the visitors there was plenty of hunting in this part of the country but very little sightseeing.,<VisionEgg.WrappedText.WrappedText object at 0x10b79a8c0>
106.0000,2.000,fix
108.0000,8.000,1,50,1,nonjoke,The only time my father ever raised a hand to his children was in ,self- defense,discipline,The only time my father ever raised a hand to his children was in discipline.,<VisionEgg.WrappedText.WrappedText object at 0x10b79aa00>
116.0000,8.000,1,88,1,nonjoke,The wind was so strong it blew out three,fuses,streetlights,The wind was so strong it blew out three streetlights.,<VisionEgg.WrappedText.WrappedText object at 0x10b79a9b0>
124.0000,12.000,fix
136.0000,8.000,1,35,1,joke,"Now that the Hollywood couple has ironed out the divorce settlement, they can finally go ahead with their",nuptials,careers,"Now that the Hollywood couple has ironed out the divorce settlement, they can finally go ahead with their nuptials.",<VisionEgg.WrappedText.WrappedText object at 0x10b79a960>
144.0000,6.000,fix
150.0000,8.000,1,91,1,joke,"If there's one thing that counts in business, its",bookkeepers,resources,"If there's one thing that counts in business, its bookkeepers.",<VisionEgg.WrappedText.WrappedText object at 0x10b79a910>
158.0000,4.000,fix
162.0000,8.000,1,61,1,joke,"For great vacation, put the kids in the back seat, and take a ",cruise,freeway,"For great vacation, put the kids in the back seat, and take a cruise.",<VisionEgg.WrappedText.WrappedText object at 0x10b79aa50>
170.0000,4.000,fix
174.0000,8.000,1,121,1,joke,"Diamonds are produced by great pressure, usually provided by a ",girlfriend,piston,"Diamonds are produced by great pressure, usually provided by a girlfriend.",<VisionEgg.WrappedText.WrappedText object at 0x10b79a820>
182.0000,2.000,fix
184.0000,8.000,1,25,1,joke,The only thing money can't buy is,poverty,generosity,The only thing money can't buy is poverty.,<VisionEgg.WrappedText.WrappedText object at 0x10b79adc0>
192.0000,8.000,1,98,1,nonjoke,"Nature has three ways of thinning the herd: drought, famine, and ",primaries,hunting,"Nature has three ways of thinning the herd: drought, famine, and hunting.",<VisionEgg.WrappedText.WrappedText object at 0x10b79ae60>
200.0000,8.000,1,41,1,joke,His doctor recommended he stay flat on his back ever since he was hit by a ,steamroller,motorist,His doctor recommended he stay flat on his back ever since he was hit by a steamroller.,<VisionEgg.WrappedText.WrappedText object at 0x10b79ae10>
208.0000,4.000,fix
212.0000,8.000,1,108,1,nonjoke,Everyone had so much fun diving from the tree into the swimming pool we decided to put in a little,water,platform,Everyone had so much fun diving from the tree into the swimming pool we decided to put in a little platform.,<VisionEgg.WrappedText.WrappedText object at 0x10b79aeb0>
220.0000,6.000,fix
226.0000,8.000,1,84,1,nonjoke,"The convict told his cellmate how he'd blown all the money he stole on wine, women, and ",lawyers,crack,"The convict told his cellmate how he'd blown all the money he stole on wine, women, and crack.",<VisionEgg.WrappedText.WrappedText object at 0x10b79af50>
234.0000,8.000,1,130,1,nonjoke,"This house comes with lots of extras, mostly",termites,upgrades,"This house comes with lots of extras, mostly upgrades.",<VisionEgg.WrappedText.WrappedText object at 0x10b79af00>
242.0000,8.000,1,97,1,joke,"When I found out how much my wife spent on dresses last year, I dumped her and proposed to the",dressmaker,mistress,"When I found out how much my wife spent on dresses last year, I dumped her and proposed to the dressmaker.",<VisionEgg.WrappedText.WrappedText object at 0x10b79afa0>
250.0000,8.000,1,43,1,joke,"I asked him if he started out as an editor, and he said that years ago he used to be a ",boy,journalist,"I asked him if he started out as an editor, and he said that years ago he used to be a boy.",<VisionEgg.WrappedText.WrappedText object at 0x10b833050>
258.0000,12.000,fix
270.0000,8.000,1,104,1,nonjoke,Politicians who are as American as apple pie still want their,slice,rewards,Politicians who are as American as apple pie still want their rewards.,<VisionEgg.WrappedText.WrappedText object at 0x10b8330a0>
278.0000,8.000,1,151,1,joke,One good turn gets most of the,blanket,profit,One good turn gets most of the blanket.,<VisionEgg.WrappedText.WrappedText object at 0x10b8330f0>
286.0000,2.000,fix
288.0000,8.000,1,147,1,joke,"When we got divorced, my wife and I split the house; she got the",inside,kitchen,"When we got divorced, my wife and I split the house; she got the inside.",<VisionEgg.WrappedText.WrappedText object at 0x10b833190>
296.0000,14.000,fix
310.0000,8.000,1,138,1,nonjoke,Modern science is amazing: garbage is now being made into,movies,gasoline,Modern science is amazing: garbage is now being made into gasoline.,<VisionEgg.WrappedText.WrappedText object at 0x10b833140>
318.0000,4.000,fix
322.0000,8.000,1,47,1,joke,"Charged with statutory rape, he told the judge he didn't know she was a ",statue,teenager,"Charged with statutory rape, he told the judge he didn't know she was a statue.",<VisionEgg.WrappedText.WrappedText object at 0x10b8331e0>
330.0000,2.000,fix
332.0000,8.000,1,144,1,nonjoke,The difference between a dog and fox is about five,beers,degrees,The difference between a dog and fox is about five degrees.,<VisionEgg.WrappedText.WrappedText object at 0x10b833280>
340.0000,2.000,fix
342.0000,8.000,1,63,1,joke,"It's hard to raise a family nowadays, especially in the ",morning,country,"It's hard to raise a family nowadays, especially in the morning.",<VisionEgg.WrappedText.WrappedText object at 0x10b833230>
350.0000,4.000,fix
354.0000,8.000,1,44,1,nonjoke,The only place where you can find people who spend all their time minding their own business is the ,cemetery,bank,The only place where you can find people who spend all their time minding their own business is the bank.,<VisionEgg.WrappedText.WrappedText object at 0x10b8332d0>
362.0000,2.000,fix
364.0000,8.000,1,21,1,joke,"She told him he looked like a million, and she meant every",century,syllable,"She told him he looked like a million, and she meant every century.",<VisionEgg.WrappedText.WrappedText object at 0x10b833320>
372.0000,2.000,fix
374.0000,8.000,1,95,1,joke,He was teaching his girlfriend how to swim when the lifeguard made them move to the ,lake,shallows,He was teaching his girlfriend how to swim when the lifeguard made them move to the lake.,<VisionEgg.WrappedText.WrappedText object at 0x10b833370>
382.0000,4.000,fix
386.0000,8.000,1,89,1,joke,"Some babies are born to rule, while others are",male,weak,"Some babies are born to rule, while others are male.",<VisionEgg.WrappedText.WrappedText object at 0x10b8333c0>
394.0000,8.000,1,131,1,joke,"Statistics indicate that Americans spend eighty million a year on games of chance, mostly",weddings, blackjack,"Statistics indicate that Americans spend eighty million a year on games of chance, mostly weddings.",<VisionEgg.WrappedText.WrappedText object at 0x10b833410>
402.0000,8.000,1,96,1,nonjoke,"When the kid came into the store and asked for empty boxes, the owner gave him the",register,crate,"When the kid came into the store and asked for empty boxes, the owner gave him the crate.",<VisionEgg.WrappedText.WrappedText object at 0x10b833460>
410.0000,8.000,fix
418.0000,8.000,1,58,1,nonjoke,The woman who has her husband eating out of her hand must save a lot of,dishwashing,heartbreak,The woman who has her husband eating out of her hand must save a lot of heartbreak.,<VisionEgg.WrappedText.WrappedText object at 0x10b8334b0>
426.0000,6.000,fix
432.0000,8.000,1,56,1,nonjoke,"When you own an ice cream business, your favorite flavor is",aspirin,everything,"When you own an ice cream business, your favorite flavor is everything.",<VisionEgg.WrappedText.WrappedText object at 0x10b833550>
440.0000,4.000,fix
444.0000,8.000,1,7,1,joke,A replacement player hit a home run with my,girl,ball,A replacement player hit a home run with my girl.,<VisionEgg.WrappedText.WrappedText object at 0x10b833500>
452.0000,8.000,1,126,1,nonjoke,My husband took the money we were saving to buy a new car and blew it all at the,laundry,tables,My husband took the money we were saving to buy a new car and blew it all at the tables.,<VisionEgg.WrappedText.WrappedText object at 0x10b8335a0>
460.0000,8.000,1,3,1,joke,A thoughtful wife has pork chops ready when her husband comes home from,fishing,working,A thoughtful wife has pork chops ready when her husband comes home from fishing.,<VisionEgg.WrappedText.WrappedText object at 0x10b8335f0>
468.0000,8.000,1,112,1,nonjoke,The art museum just acquired an early Rembrandt; it's done in ,Crayola,charcoal,The art museum just acquired an early Rembrandt; it's done in charcoal.,<VisionEgg.WrappedText.WrappedText object at 0x10b833640>
476.0000,2.000,fix
478.0000,8.000,1,118,1,nonjoke,Cocktails lounges are usually half lit to match the,patrons,setting,Cocktails lounges are usually half lit to match the setting.,<VisionEgg.WrappedText.WrappedText object at 0x10b833690>
486.0000,8.000,1,81,1,joke,Another thing that has developed by leaps and bounds is modern,dance,science,Another thing that has developed by leaps and bounds is modern dance.,<VisionEgg.WrappedText.WrappedText object at 0x10b8336e0>
494.0000,4.000,fix
498.0000,8.000,1,117,1,joke,"All roads lead to Rome, and all detours lead to",profanity,somewhere,"All roads lead to Rome, and all detours lead to profanity.",<VisionEgg.WrappedText.WrappedText object at 0x10b833730>
506.0000,8.000,1,146,1,nonjoke,"Love has its benefits, and they are usually called",alimony,memories,"Love has its benefits, and they are usually called memories.",<VisionEgg.WrappedText.WrappedText object at 0x10b833780>
514.0000,2.000,fix
516.0000,8.000,1,48,1,nonjoke,"The new tax forms are more realistic: where your wife signs, it says","""accomplice""","""partner""","The new tax forms are more realistic: where your wife signs, it says ""partner"".",<VisionEgg.WrappedText.WrappedText object at 0x10b8337d0>
524.0000,2.000,fix
526.0000,8.000,1,94,1,nonjoke,"To get something done, a committee should consist of no more than three people, two of whom are",dead,workers,"To get something done, a committee should consist of no more than three people, two of whom are workers.",<VisionEgg.WrappedText.WrappedText object at 0x10b833870>
534.0000,8.000,1,22,1,nonjoke,Our son brought home a note from school saying they need a written excuse for his,presence,tardiness,Our son brought home a note from school saying they need a written excuse for his tardiness.,<VisionEgg.WrappedText.WrappedText object at 0x10b8338c0>
542.0000,2.000,fix
544.0000,8.000,1,11,1,joke,"He owns stock in a company that pays quarterly dividends, so every three months they send him a",quarter,statement,"He owns stock in a company that pays quarterly dividends, so every three months they send him a quarter.",<VisionEgg.WrappedText.WrappedText object at 0x10b833910>
552.0000,2.000,fix
554.0000,8.000,1,71,1,joke,Save the whales; start a,collection,coalition,Save the whales; start a collection.,<VisionEgg.WrappedText.WrappedText object at 0x10b833960>
562.0000,8.000,fix
xxx,1,100,1,nonjoke,"I hope this train stops at Grand Central because if it doesn't, there will be a ",crash,delay,"I hope this train stops at Grand Central because if it doesn't, there will be a delay.",1,1.9254708290100098,6.0144431591033936
xxx,1,102,1,nonjoke,We live in a lovely suburb; it's just two miles beyond our,income,town,We live in a lovely suburb; it's just two miles beyond our town.,1,0.40302395820617676,16.009024143218994
xxx,1,153,1,joke,The husband who catches his wife in the act is probably on the,trapeze,snoop,The husband who catches his wife in the act is probably on the trapeze.,3,1.6415908336639404,24.010531187057495
xxx,1,86,1,nonjoke,"I asked the florist what I should give to my girlfriend, and he suggested his",address,tulips,"I asked the florist what I should give to my girlfriend, and he suggested his tulips.",2,1.3406939506530762,34.0048451423645
xxx,1,39,1,joke,The best way to remove coffee stains from a white blouse is with,scissors,detergent,The best way to remove coffee stains from a white blouse is with scissors.,,,44.0158851146698
